id,lang,created_at,conversation_id,author_id,text,retweet_count,reply_count,like_count,quote_count,en_text,polarity,subjectivity
1.553242368463507e+18,id,2022-07-30 04:53:33,1.553241597705613e+18,92537405.0,"@korbanxiklan Salah sijine masku sing saiki nembe kangelan

Game developer indie, game engine unreal nggone epic, pemasaran lewat epic lan steam, duit hasile lewat paypal, diblokir kabeh karo kominfo asu",0,2,0,0,"@korbanx advertisement wrong sijine masku sing saiki nembe kangelan

Indie Game Developer, Unreal Nggone Epic Mobile Game, Marketing Through Epic Lan Steam, Money of the results through PayPal, Blocked Karo Kominfo Asu Kabeh Kabeh",-0.1833333333333333,0.4166666666666667
1.5532420489914e+18,en,2022-07-30 04:52:16,1.553241704219566e+18,8.407935077028864e+17,"Steam and epic games too??

Fuck kominfo
All my homies hate kominfo",0,0,0,0,"Steam and epic games too??

Fuck kominfo
All my homies hate kominfo",-0.3666666666666667,0.6333333333333333
1.553241946365256e+18,lt,2022-07-30 04:51:52,1.553241946365256e+18,1.469625564961124e+18,"Steam Epic games Paypal Dota diblokir kominfo Indonesia PSE blokir
https://t.co/EFyKoDtRHG",0,0,0,0,"Steam Epic Games PayPal Dota Diblokir Komokir Indonesia PSE BLOKIR
https://t.co/fykodytrhg",0.1,0.4
1.553241299645772e+18,id,2022-07-30 04:49:18,1.553241299645772e+18,791558136.0,"Timeline twitter lagi rame masalah steam, Paypal, epic games yang diblokir sama kominfo. Saatnya buka Youtube nonton podcast pesulap merah vs dukun palsu.",0,0,0,0,"Twitter timeline is crowded with steam, Paypal, Epic Games problems that are blocked by Kominfo. It's time to open YouTube watching the red magician podcast vs. Fake Shaman.",-0.1,0.475
1.553241256691507e+18,id,2022-07-30 04:49:08,1.553241256691507e+18,9.426535531511726e+17,"Steam dan Epic Games Store Kena Blokir, Netizen Murka ke Kominfo https://t.co/0PL83Ybc1C",0,0,0,0,"Steam and Epic Games Store are blocked, netizens are angry to Kominfo https://t.co/0pl83ybc1c",-0.2,0.7
1.553241042501386e+18,id,2022-07-30 04:48:17,1.553188847617331e+18,1.434863109672346e+18,"@kemkominfo Pentingnya mengisi kantor Kominfo dengan orang2 yang ber- otak
Bukan cuman datang duduk manis. Dan begini hasil kerjanya. Situs judi lolos.  Steam epic ga lolos. Punya otak?",0,0,0,0,"@kemkominfo The importance of filling the Communication and Information Office with people who are brain
It's not just coming to sit sweetly. And this is the result of his work. Gambling site passed. Steam Epic doesn't escape. Have a brain?",0.225,0.525
1.553240845419442e+18,id,2022-07-30 04:47:30,1.553240845419442e+18,1487584172.0,KOMINFO KONTOLLLL KENAPA STEAM DI BLOKIR GOBLOKKKK TOLOL MEMEK KONTOL BANGSATTT KOMINFO GAGAL NGENTOTTT EPIC JUGA DI BAN GAME GUA PADA KEMANA SEMUA ANJING TOLOLL TOLOL GOBLOK #BlokirKominfo,0,0,1,0,KOMINFO CONTROLLLL Why Steam was blocked by Goblokkkk stupid pussy dick bangsattt Kominfo failed to fuck epic also in my gaming tires where all the stupid stupid tololl dogs #blokirkominfo,-0.5333333333333332,0.7166666666666667
1.553240572584149e+18,id,2022-07-30 04:46:24,1.553240572584149e+18,9.702215193379635e+17,"Kominfo Sadar g sih kalo ngeblokir steam, epic, etc sama dengan blokir rejeki orang. developer indie karya anak bangsa rata2 Rilis gamenya lewat steam karena pasar yang besar Dan juga konten kreator gaming indonesia Membuat pengahasilan lewat main game via steam atau Epic",0,0,0,0,"Kominfo is aware if you block steam, epic, etc are the same as blocking people's fortune. Indie developers by children of the nation on average the game released through steam because of a large market and also the content of gaming Indonesian creators made success through playing games via steam or epic",0.04603174603174603,0.2670634920634921
1.55324056894736e+18,id,2022-07-30 04:46:24,1.553211846232252e+18,1.5154752186049e+18,"Cara akses Steam, PayPal, Epic Games yang diblokir Kominfo part 2

#BlokirKominfo #ProtesNetizen #PSEmelanggarHAM https://t.co/qbjFlLpRWr",1,0,6,0,"How to access steam, paypal, epic games that are blocked by the Ministry of Communication and Information Part 2

#Blokirkominfo #Protesnetizen #PSemelanggarham https://t.co/qbjflprwr",0.1,0.4
1.553240324184895e+18,en,2022-07-30 04:45:25,1.553240324184895e+18,1.26040468640369e+18,"Steam, PayPal, and epic games are blocked by kominfo... How are we gonna find some fun? Pirating it is... (Jk)",0,0,0,0,"Steam, PayPal, and epic games are blocked by kominfo... How are we gonna find some fun? Pirating it is... (Jk)",0.2,0.3
1.553240304710431e+18,id,2022-07-30 04:45:21,1.553211846232252e+18,1.5154752186049e+18,"For my fellow Indonesian 🇮🇩

Cara akses Steam, PayPal, Epic Games yang diblokir Kominfo part 1

#BlokirKominfo #ProtesNetizen #PSEmelanggarHAM https://t.co/nqQDoXXWCS",3,1,16,1,"For my fellow Indonesian 🇮🇩

How to access steam, paypal, epic games that are blocked by the Ministry of Communication and Information Part 1

#Blokirkominfo #Protesnetizen #PSemelanggarham https://t.co/nqqdoxxwcs",0.1,0.4
1.553240219214021e+18,id,2022-07-30 04:45:00,1.553240219214021e+18,1.353539712900719e+18,"You just made me lost RP 5 million+ from blocking epic games @kemkominfo 
NAnti kedepannya block apa? Block whatsapp? Atau mungkin block youtube? C'mon kominfo think before u act. Kenapa ga blokir situs perjudian aja? Atau situs pornografi?  #BlokirKominfo",0,0,0,0,"You just made me lost Rp. 5 million+ from blocking epic games @kemkominfo
What will Block in the future be in the future? Block WhatsApp? Or maybe youtube block? C'Mon Kominfo Think Before U Act. Why not just block gambling sites? Or pornography site? #Blokirkominfo",0.03333333333333333,0.2166666666666667
1.553240120220058e+18,id,2022-07-30 04:44:37,1.553240120220058e+18,279617505.0,"giliran steam epic di blokir, judi slot zeus pragmatic gak di blok kominfo ngentod",0,1,0,0,"Steam Epic's turn to be blocked, Zeus Pragmatic slot gambling is not in the Kominfo block",0.1,0.4
1.553239936358584e+18,en,2022-07-30 04:43:53,1.55323948983296e+18,1.213822267911655e+18,"so for those of you who are unaware or just don't give enough of a fuck, kominfo which is indonesia's ministry of telecommunication and all that shit has recently blocked some major gaming sites like steam and epic games along with a major international money site which is paypal",0,1,0,0,"so for those of you who are unaware or just don't give enough of a fuck, kominfo which is indonesia's ministry of telecommunication and all that shit has recently blocked some major gaming sites like steam and epic games along with a major international money site which is paypal",-0.04166666666666668,0.4500000000000001
1.55323958198988e+18,id,2022-07-30 04:42:28,1.55323958198988e+18,1.437980879343653e+18,"kominfo ni ngapa ban steam,paypal,sama epic game anjir",0,1,2,0,"Kominfo, why are ban steam, paypal, and the epic game anjir",-0.15,0.4
1.553239545432273e+18,id,2022-07-30 04:42:20,1.553239545432273e+18,167371613.0,"Kominfo harus refund duit rakyat yg udah beli game, di steam, epic games, gaji orang di paypal lah, jangan bisanya nge block doang tolol.",1,0,0,0,"Kominfo must refund the people's money who have already bought games, in steam, epic games, the salaries of people in Paypal, don't be able to block stupidly.",-0.06666666666666665,0.6749999999999999
1.553239211360236e+18,en,2022-07-30 04:41:00,1.553239211360236e+18,360689529.0,"*Sigh* (Grab pirate hat).

https://t.co/SQruae0Bor",0,0,0,0,"*Sigh* (Grab pirate hat).

https://t.co/SQruae0Bor",0.0,0.0
1.553239205870186e+18,id,2022-07-30 04:40:59,1.553239205870186e+18,1.216643519965585e+18,"tolong @kemkominfo steam,paypal,epic games,dota dll jangan diblokir
uang gua disana semua 😭😭😭

#steamdibanned
#steamdown 
#kominfo 
#BlokirKominfo",0,0,1,0,"Please @kemkominfo steam, paypal, epic games, dota etc.
My money is there all &T

#steamdibanned
#steamdown
#Kominfo
#Blokirkominfo",0.1,0.4
1.553239080917676e+18,id,2022-07-30 04:40:29,1.553239080917676e+18,1.318190928994001e+18,"Ini kominfo minta kita untuk main game bajakan ato gimana yak, trus kenapa di blokir steam, epic games, dll. Kenapa di blokir gitu lho. Padahal situs judi online aja ga diblokir. #BlokirKominfo https://t.co/ebNgjmmL66",0,0,1,0,"This Kominfo asks us to play pirated games or how yak, then why be blocked Steam, Epic Games, etc. Why is it blocked like that. Even though online gambling sites are not blocked. #Blokirkominfo https://t.co/ebngjmml66",0.1,0.4
1.553239055877698e+18,id,2022-07-30 04:40:23,1.553239055877698e+18,4705732466.0,"udah cukup steam epic dan lainnya, ampe blokir link bola tak serbu kominfo",0,0,0,0,"It's enough to steam epic and others, until blocking the ball link not assault Kominfo",0.05,0.45
1.553239035677553e+18,id,2022-07-30 04:40:18,1.553239035677553e+18,1.51732187276066e+18,"Inilah Solusi Untuk Buka Paypal, Steam, Epic Games Yang di Blokir Kominfo https://t.co/a7EXQaFwvB lewat @teknokdr 
#PayPal 
#PSE 
#PSEmelanggarHAM",1,0,0,0,"This is the solution to open Paypal, Steam, Epic Games that are blocked by Kominfo https://t.co/a7exqafwvb via @teknokdr
#Paypal
#PSE
#PSeMeManggarham",0.05,0.45
1.553239034301846e+18,id,2022-07-30 04:40:18,1.553239031894315e+18,93356134.0,"Lima platform digital yang mulai diblokir Kominfo termasuk kategori platform game dan distribusi game populer yang ada di Tanah Air, sebagai berikut:

-Epic Games (platform distribusi game)
-Steam (platform distribusi game)
-Dota (game)
-Counter Strike (game)
-Origin (EA)",0,1,0,0,"Five digital platforms that have begun to be blocked by the Ministry of Communication and Information including the category of game platforms and popular game distribution in the country, as follows:

-Epic Games (Game Distribution Platform)
-Steam (Game Distribution Platform)
-Dota (Game)
-Counter Strike (Game)
-Origin (EA)",-0.1888888888888889,0.4111111111111111
1.553238886050157e+18,id,2022-07-30 04:39:42,1.553238886050157e+18,2243116382.0,"Kominfo Mulai Sanksi Paypal, Yahoo, Epic Games Dkk Jika Tak Daftar PSE https://t.co/JXXhGRV5GP",0,0,0,0,"Kominfo Starts Paypal Sanctions, Yahoo, Epic Games et al If you don't list PSE https://t.co/jxxhgrv5g",0.1,0.4
1.553238640838742e+18,id,2022-07-30 04:38:44,1.553238640838742e+18,1.100724332995633e+18,"Skuy spam hastag #BlokirKominfo sampe kominfo buka blokir steam, epic game, paypal, yahoo dll atau hapus pse itu aja @kemkominfo",0,0,1,0,"SKUY SPAM Hastag #Blokirkominfo until Kominfo unlocked steam, epic game, paypal, yahoo etc. or just delete pse @kemkominfo",-0.15,0.4
1.553238421501399e+18,id,2022-07-30 04:37:52,1.553238421501399e+18,990562405.0,"Gmna ceritanya nasib streamer gaming yang rata2 mereka main gamenya itu dari steam dan epic game dan freelancer yang cari duit melalui paypal 
Apa kabar game judi lain seperti domino dan situs2 judi lainnya? 
R u fucking kidding me sir? @kemkominfo #BlokirKominfo #kominfo https://t.co/yR2JqbAKjs",0,0,3,0,"How's the story of the fate of the gaming streamer that they on average play the game from Steam and Epic Games and Freelancers who are looking for money through Paypal
How are other gambling games like dominoes and other gambling sites?
R U Fucking Kidding Me Sir? @kemkominfo #blokirkominfo #kominfo https://t.co/yr2jqbakjs",-0.2166666666666667,0.4583333333333333
1.55323831382521e+18,id,2022-07-30 04:37:26,1.55323831382521e+18,1.179755272207626e+18,"Sekarang main game lewat steam, epic,dlll di blokir terus lebih parahnya lagi paypal juga ikutan, emang Kominfo maunya gimana sih?banyak loh yang nyari duit lewat paypal. 
#BlokirKominfo https://t.co/pkLbJYVbkI",0,0,0,0,"Now playing games through Steam, Epic, etc. is blocked and even worse, Paypal also follows, what do you want to do?
#Blokirkominfo https://t.co/pklbjyvbki",-0.15,0.5
1.553238016575291e+18,id,2022-07-30 04:36:15,1.553238016575291e+18,1.050327762014065e+18,Kontol ah aku download GTA V di epic games belum kelar udh keburu diblokir. Kominfo bangsattttt,0,1,0,0,Dick ah I download GTA V in Epic Games hasn't finished being blocked. KOMINFO BAKATTTTTT,0.1,0.4
1.553237626635039e+18,id,2022-07-30 04:34:42,1.553237626635039e+18,111810165.0,"SobatKom, siapa nih yang hobi main game online? 

Wah, sudah pasti banyak ya! Karena semakin menjamurnya peminat game online di Indonesia, Kementerian Kominfo berencana akan memblokir penyedia game legal seperti Steam dan Epic Games. https://t.co/jHLmF6QHyN",0,0,0,0,"Sobatkom, who likes to play online games?

Wow, there are definitely a lot! Because of the increasingly mushrooming of online game enthusiasts in Indonesia, the Ministry of Communication and Information plans to block legal game providers such as Steam and Epic Games. https://t.co/jhlmf6qhyn",-0.05714285714285715,0.4857142857142857
1.553237369851384e+18,id,2022-07-30 04:33:41,1.553152094147736e+18,1.074537836479566e+18,"@justpramudito Gak patuh karna durung daftar sih. https://t.co/D6NhSgm07z

Kyknya yg dipertanyakan adlh knp steam dll kok ga daftar PSE iku. 
Sdgkn ngomong dampak, harusnya jadi tanggung jawab steam dll sbg penyedia jasa untuk patuh sm peraturan kominfo. 

Toh platform lain bisa patuh juga kan",0,1,0,0,"@justpramudito is not obedient because durung lists anyway. https://t.co/d6nhsgm07z

The question is what is questioned, why isn't it a list of pse iku.
SDGKN Talking about the impact, it should be the responsibility of Steam etc. as a service provider to obey the Ministry of Communication and Information.

After all, other platforms can obey too",-0.1625,0.6375
1.553237090963296e+18,en,2022-07-30 04:32:34,1.553237090963296e+18,1.326926709380166e+18,"Waking up hating kominfo immediately after knowing they blocked steam epic games and paypal for no reason like kominfo anjing kontol

Tempat judi slot kagak diblokir? Karena pegawainya yang boomer gendut main:p https://t.co/QbXr1ImSeb",22,8,119,0,"Waking up hating kominfo immediately after knowing they blocked steam epic games and paypal for no reason like kominfo anjing kontol

Tempat judi slot kagak diblokir? Karena pegawainya yang boomer gendut main:p https://t.co/QbXr1ImSeb",0.1,0.4
1.55323708321264e+18,en,2022-07-30 04:32:33,1.55323459040775e+18,1.539257675644645e+18,"Kominfo a.k.a Ministry of Communication and Information Technology Indonesia are blocking (as far as I read on kompas) Yahoo, PayPal, Epic Games, Steam, Dota, Counter Strike, and Origin in Indonesia. Because they didn't register theirself on PSE (idek what it is, Im mad)",0,2,0,0,"Kominfo a.k.a Ministry of Communication and Information Technology Indonesia are blocking (as far as I read on kompas) Yahoo, PayPal, Epic Games, Steam, Dota, Counter Strike, and Origin in Indonesia. Because they didn't register theirself on PSE (idek what it is, Im mad)",-0.1416666666666667,0.7999999999999999
1.553237018708042e+18,id,2022-07-30 04:32:17,1.553201079810003e+18,1.522033381206229e+18,@airaniiofifteen Hari ini resmi steam sama Epic serta kawan kawannya diblokir dari Kominfo,0,0,0,0,@urahiiofifteen today officially steam and epic and friends are blocked from the Ministry of Communication and Information,0.1,0.4
1.553236982222189e+18,id,2022-07-30 04:32:08,1.553236982222189e+18,1.31841620516678e+18,"PayPal, Steam, Epic Games di blokir Kominfo. Bagaimana menurut kalian?",0,0,0,0,"Paypal, Steam, Epic Games are blocked by Kominfo. What do you think?",0.1,0.4
1.553236902014497e+18,id,2022-07-30 04:31:49,1.553236902014497e+18,1038689244.0,"Pantesan ga bisa main Fortnite, asem lah. Piye iki @cemiin 

https://t.co/RRHIHGxBhG",0,2,0,0,"No wonder I can't play Fortnite, it's tamarind. Piye iki @cemiin

https://t.co/rrhihgxbhg",0.0,0.0
1.55323689639832e+18,id,2022-07-30 04:31:48,1.55323689639832e+18,1.365653051495703e+18,"Kenapa selalu jam 12 malem? teori nih gengs.

#BlokirKominfo Paypal, Epic Games, Indonesia, Origin, Dota, CS GO, Zuma, 

https://t.co/hyRAojVHlh",1,0,2,0,"Why is it always at 12 pm? Theory is gangs.

#Blokirkominfo paypal, epic games, indonesia, origin, dota, cs go, zuma,

https://t.co/hyraojvhlh",0.1,0.4
1.553236777866891e+18,id,2022-07-30 04:31:20,1.553236777866891e+18,1.553034213221224e+18,"Terlihat bercanda namun tidak, sekitar subuh pagi ini (30/7) Steam, Paypal, Origin, dan Epic Games telah diblokir oleh KOMINFO, rata-rata website layanan dan streaming game yang ramai dipakai oleh gamers.
selengkapnya baca di https://t.co/IYtzG1xvfn
#kominfo #steam #paypal",7,0,4,0,"Seen joking but no, around dawn this morning (30/7) Steam, Paypal, Origin, and Epic Games have been blocked by Kominfo, the average service website and streaming games that are crowded by gamers.
Read more at https://t.co/iytzg1xvfn
#kominfo #steam #paypal",0.15,0.4333333333333333
1.553236709005234e+18,id,2022-07-30 04:31:03,1.553236709005234e+18,1.168780762591547e+18,"Why u such a clown kominfo
Game judi aja gk diblokir
Malah steam twitch epic games yg diblokir
Rip indo streamers
#BlokirKominfo",0,0,5,0,"Why u such a clown Kominfo
Gambling games aren't blocked
In fact, Steam Twitch Epic Games that are blocked
RIP Indo Streamers
#Blokirkominfo",0.05,0.45
1.553236627027157e+18,id,2022-07-30 04:30:44,1.553236627027157e+18,1.073026157505741e+18,"gua si gapapa ya kalau steam, epic, origin dll diblokir walaupun beberapa hari ini lagi push division efootball tp gapapa masih bisa diisi kegiatan yang lain. yang gua pertanyain adalah apakah kominfo mikir dengan diblokirbya platform game tsb sama aja mematikan industri ini?",0,1,1,0,"I'm fine if Steam, Epic, Origin etc. are blocked even though these days again push division efootball but it's still possible to be filled with other activities. What I question is, is the Ministry of Communication and Information thinking about being blocked by the game platform that is just turning off this industry?",0.06527777777777778,0.5958333333333333
1.553236623747609e+18,id,2022-07-30 04:30:43,1.553236623747609e+18,74742697.0,"Anjim lahh Kominfo niii.... Jancuk jancuk.
Epic jg kena blokir
#BlokirKominfo https://t.co/0NTEWUYDC1",1,0,1,0,"Anjim Lahh Kominfo Niii .... Jancuk Jancuk.
Epic is also blocked
#Blokirkominfo https://t.co/0ntewuydc1",0.1,0.4
1.553236440284561e+18,id,2022-07-30 04:29:59,1.553236440284561e+18,21100190.0,"Steam, Epic Games, Counter Strike, Dota, dan Origin Sudah Diblokir Kominfo Hari Ini

Klik untuk baca: https://t.co/aHhtqj5A9G",0,0,0,0,"Steam, Epic Games, Counter Strike, Dota, and Origin have been blocked by the Ministry of Communication and Information today

Click to read: https://t.co/ahhtqj5a9g",0.1,0.4
1.553236274185548e+18,id,2022-07-30 04:29:20,1.552203283535606e+18,64006018.0,"@Just_Ayu_ @Akubar332 @kemkominfo iya kk, bahkan lebih karena ini baru akun Steam, saya juga ada akun Origin dan Epic yang sekitar puluhan juta nilainya, dan itu kita pun beli udah kena pajak 11% bukannya ilegal, ternyata malah kominfo seenaknya #BlokirKominfo",0,1,2,0,"@Just_ayu_ @akubar332 @kemkominfo yes kk, even more because this is just a steam account, I also have a origin and epic account that is around tens of millions of value, and that we also buy already taxed 11% instead",0.3,0.45
1.553236039984038e+18,id,2022-07-30 04:28:24,1.553236039984038e+18,1537930110.0,"Nanya aja, Pak @kemkominfo 
Berdasarkan informasi dari Kominfo, ada delapan PSE Lingkup Privat yg resmi diblokir, yaitu Yahoo search engine or mesin carinya, Steam, Dota, Counter-Strike, Epic Gms, https://t.co/IhFKelrsuN, https://t.co/X4tA31ypy9, dan PayPal. 
udah kelar blom nih https://t.co/4iZkm6phhl",0,1,0,0,"Just ask, sir @kemkominfo
Based on information from the Ministry of Communication and Information, there are eight private scope that is officially blocked, namely Yahoo Search Engine or Carry Machine, Steam, Dota, Counter-Strike, Epic GMS, https://t.co/ihfkelrsun, https://t.co /X4TA31YPY9, and PayPal.
already finished blom https://t.co/4izkm6phhl",0.05,0.3875
1.553235801026089e+18,id,2022-07-30 04:27:27,1.553235801026089e+18,7.532522049459569e+17,AH BABI KOMINFO KENAPA EPIC GAMES DIBLOCK GUE NGERENDER TUGAS ARSI PAKE TWINMOTION AJSBEJDBEBD 😭😭😭😭😭😭,2,1,4,0,Ah Pig Kominfo Why is Epic Games Blocking I Breed Arsi's Task Using Twinmotion Ajsbejdbebd &T,0.1,0.4
1.553235779467747e+18,id,2022-07-30 04:27:22,1.553235779467747e+18,280029366.0,Biar apasih steam sama epic games di blokir kominfo tuh biar apa ngentot????,0,0,0,0,"So what is steam and epic games blocked by the Ministry of Communication and Information, what are you making it up ????",0.1,0.4
1.55323570818977e+18,id,2022-07-30 04:27:05,1.55323570818977e+18,39933002.0,"Disebut belum daftar PSE, beberapa situs game favorit resmi diblokir Kominfo mulai hari ini #BlokirKominfo #kominfo
 
https://t.co/B7DGkLyO4A",0,0,0,0,"Called not yet a list of PSE, some of the Favorite Game Sites Officially Blocked Kominfo Starting Today #Blokirkominfo #kominfo
 
https://t.co/b7dgklyo4a",0.03333333333333333,0.5
1.553235597984031e+18,id,2022-07-30 04:26:38,1.553230892398551e+18,154786978.0,"Atau emg si bapak-bapak bangsat di kominfo gatau klo game-game esport diaksesnya pake launcher macem steam, epic, origin dll. ?",0,1,0,0,"Or emg the bastard fathers in the Ministry of Communication and Information, if the eSport games are accessed using launcher macem steam, epic, origin etc. ?",0.1,0.4
1.553235507190018e+18,id,2022-07-30 04:26:17,1.553235507190018e+18,1.171016616085115e+18,"🛒https://t.co/a2PUFhtyG7

Trending: #kominfo Dunia Tipu-Tipu #YoonA Ardhito #YangHilangDalamCinta Malam 1 Choki #BlokirKominfo VPN Epic Games #PengabdiSetan2 Slot #PejuangShopeeTHR Dota Vaksin

👇Chek It👇 https://t.co/sIxIG2liOU https://t.co/w7sS97ZYhS",0,0,0,0,"🛒https: //t.co/a2puftyg7

Trending: #KOMINFO World Deception #Yoona Ardhito #yangHanghilangdalamcinta Night 1 Choki #Blokirkominfo VPN Epic Games #PERSESTETAN2 SLOTS #Peper

👇Chek it https://t.co/sixig2lou https://t.co/w7ss97zyhs",0.1,0.4
1.55323534482883e+18,id,2022-07-30 04:25:38,1.55323534482883e+18,87161862.0,"Steam, Epic Games, PayPal, Origin resmi telah diblokir Kominfo hari ini‼️

Yahhhh main games apalagi nih? Menurut Teman Motion, langkah dari @kemkominfo gimana nihhh? 🧐🤔

#esport #kominfo #blokir #games #PayPal #epicgames https://t.co/f7ZkYIVz6e",1,0,0,0,"Steam, Epic Games, Paypal, Origin officially blocked by the Ministry of Communication and Information today‼ ️

YeahhhhhhhhhhhhhhhhhhhhhhhhhhhhhhhhhhhhhhhhhhhhhhhhhhhhhhhhhhhhhhhhhhhhhhhhhhhhhhhhhhhhhhhhhhhhhhH According to Motion friends, how do you do the step from @kemkominfo? 🧐🤔

#esport #kominfo #blokir #games #paypal #epicgames https://t.co/f7zkyivz6e",0.1,0.4
1.553234746569892e+18,et,2022-07-30 04:23:15,1.553234746569892e+18,223476605.0,"Kominfo Blokir Platform Game Dota, Steam, Counter Strike hinga Epic Game Mulai Hari Ini https://t.co/uSbbv3zxm0",0,0,1,0,"Kominfo Bloker Platform Game Dota, Steam, Counter Strike Breathe Epic Game Mulai Hari Ini https://t.co/usbbv3zxm0",-0.2333333333333334,0.4000000000000001
1.553234656794792e+18,id,2022-07-30 04:22:54,1.553233389947605e+18,1.380782788933128e+18,@aikaragisa ye pake cara itu jehh.. smaa ajah .. beberapa wipi emang bisa ke steam/epic/yg kominfo block but baik wifi sebgaian dan isp provider mobile macam telkomsul dkk masih gabisa,0,1,2,0,@aikaragisa who use that method jehh .. smaa ajah .. some wipi can indeed go to steam/epic/the communication communication but both wifi as many and mobile providers like telkomsul et al still can't,0.5,0.5
1.553234370080948e+18,id,2022-07-30 04:21:46,1.553234370080948e+18,1.286450794502353e+18,"Buset dah kominfo ngeblokir steam ama epic, dikira beli game pake daon apa NGENTOT",0,1,1,0,"The Kominfo has blocked Steam and Epic, it is thought to have bought the game using Daon or what",-0.15,0.4
1.553234117042401e+18,id,2022-07-30 04:20:45,1.553234117042401e+18,1.294115755282199e+18,"sumpahh kominfo blok steam, epic games, origin, sama paypal smh, uang gw di paypal gk bisa ditarik hhhhhhhhhhhh @kemkominfo plis lah unblok semuanya",0,1,0,0,"I swear Kominfo block steam, epic games, origin, and paypal smh, my money in Paypal can't be withdrawn hhhhhhhhhhh @kemkominfo plis is all",0.1,0.4
1.553233887693791e+18,id,2022-07-30 04:19:51,1.553233887693791e+18,508977909.0,"Tidak Daftar PSE, Kominfo Blokir Platform Steam, Epic Games, hingga PayPal Hari ini https://t.co/dWkpiXUbNo",0,0,0,0,"Not listing PSE, Kominfo blocks Steam platforms, epic games, to paypal today https://t.co/dwkpixubno",0.1,0.4
1.553233441386144e+18,id,2022-07-30 04:18:04,1.553227740467253e+18,1.245362616207176e+18,"@FRAS_Shoyo Banyak berita yang sudah beredar bahwa situs game seperti Steam, Epic Games, Dota dan sejenisnya diblokir oleh Kominfo dini hari tadi. Maaf, ya Fras kalau Hiroshi undur lagi collab gamenya, apalagi Hiroshi ada tugas kedinasan ke luar provinsi selama 6 bulan",0,0,1,0,"@Fras_shoyo a lot of news has been circulating that game sites such as Steam, Epic Games, Dota and the like are blocked by Kominfo early this morning. Sorry, yes Fras if Hiroshi resigned again the game, especially Hiroshi there was an official task outside the province for 6 months",-0.1375,0.50625
1.553233429302432e+18,en,2022-07-30 04:18:01,1.553233429302432e+18,1.40115111093341e+18,"he blocked steam, paypal, epic games, etc.
Thank you Kominfo 🤓🤓
#BlokirKominfo https://t.co/fQaLvmnReO",1,2,11,0,"he blocked steam, paypal, epic games, etc.
Thank you Kominfo 🤓🤓
#BlokirKominfo https://t.co/fQaLvmnReO",0.1,0.4
1.553233427109126e+18,en,2022-07-30 04:18:01,1.553233427109126e+18,1.503956860935713e+18,"--flatface--
https://t.co/GwPwpJYjdh 
#BlokirKominfo",0,0,0,0,"--flatface--
https://t.co/GwPwpJYjdh 
#BlokirKominfo",0.0,0.0
1.553233397442834e+18,en,2022-07-30 04:17:54,1.553233397442834e+18,3020429064.0,"Kominfo:
Steam, Epic Games, PayPal, Dota ❌❌

Pinjol, Slot, Judi online, pornhub ✅✅

#BlokirKominfo https://t.co/1fOiD6PeAb",837,54,3600,78,"Kominfo:
Steam, Epic Games, PayPal, Dota ❌❌

Pinjol, Slot, Judi online, pornhub ✅✅

#BlokirKominfo https://t.co/1fOiD6PeAb",0.1,0.4
