id,lang,created_at,conversation_id,author_id,text,retweet_count,reply_count,like_count,quote_count,en_text,polarity,subjectivity
1.553202097784381e+18,id,2022-07-30 02:13:31,1.553202097784381e+18,303078111.0,"Oramg2 Kominfo ini isinya boomer2 yang kalo liat anaknya main game langsung jepretin listrik. Makanya diblokir dahh steam, Epic. Gak lama lagi PSN diblokir nihh.",0,0,0,0,"Oramg2 Kominfo is the contents of the boomer who if you see the child playing the game directly shot electricity. So blocked by Dahh Steam, Epic. Not long after PSN was blocked.",-0.04375000000000001,0.4
1.553201770771485e+18,id,2022-07-30 02:12:13,1.553201770771485e+18,69183155.0,"Kominfo memastikan Steam, Epic Games, PayPal milik Elon Musk masuk dalam daftar pemblokiran Kominfo. Tapi di saat bersamaan, Yahoo masih bisa diakses bebas.  https://t.co/IvdolSqTgk",15,18,42,5,"Kominfo confirmed that Steam, Epic Games, Elon Musk's Paypal was included in the Kominfo blocking list. But at the same time, Yahoo can still be accessed freely. https://t.co/ivdolsqtgk",0.225,0.58125
1.553201766774317e+18,id,2022-07-30 02:12:12,1.553201766774317e+18,135815019.0,"Kominfo memastikan Steam, Epic Games, PayPal milik Elon Musk masuk dalam daftar pemblokiran Kominfo. Tapi di saat bersamaan, Yahoo masih bisa diakses bebas.  https://t.co/aJx3MvsI1G",0,0,1,1,"Kominfo confirmed that Steam, Epic Games, Elon Musk's Paypal was included in the Kominfo blocking list. But at the same time, Yahoo can still be accessed freely. https://t.co/ajx3mvsi1g",0.225,0.58125
1.553201742011339e+18,id,2022-07-30 02:12:07,1.553153893114483e+18,1.404963161669661e+18,"@txtfrombrand Kominfo: ngurus situs judi online, sms spam penipuan, telpon penipuan ❌

Kominfo: block epic games, steam, PayPal ✅",0,0,0,0,"@txtfrombrand Kominfo: Take care of online gambling sites, sms spam fraud, fraud telephone ❌

Kominfo: Block Epic Games, Steam, Paypal ✅",0.1,0.4
1.553201734407049e+18,id,2022-07-30 02:12:05,1.553201734407049e+18,1.438684307296424e+18,KOMINFO Anjinggg gw udah spend 400ribu di steam ama 200rb di epic asuuu,0,0,0,0,Kominfo Anjinggg I already spend 400 thousand in Steam AMA 200 thousand in Epic Asuuu,0.1,0.4
1.553201483843523e+18,qme,2022-07-30 02:11:05,1.553167689266434e+18,4802389219.0,@Vikkristian12 https://t.co/JHfLEfD4ID,0,0,1,0,,,
1.55320145347258e+18,qme,2022-07-30 02:10:58,1.553171498763882e+18,4802389219.0,@MstrYoda @kemkominfo https://t.co/JHfLEfD4ID,0,0,0,0,,,
1.55320142069409e+18,qme,2022-07-30 02:10:50,1.553150254249259e+18,4802389219.0,@AfterDarkAngelo https://t.co/JHfLEfD4ID,0,0,0,0,,,
1.553201379044631e+18,qme,2022-07-30 02:10:40,1.553162964588708e+18,4802389219.0,@InginGondrong https://t.co/JHfLEfD4ID,0,0,0,0,,,
1.55320134514627e+18,qme,2022-07-30 02:10:32,1.553158055583314e+18,4802389219.0,@Flame07908952 https://t.co/JHfLEfD4ID,0,1,0,0,,,
1.553201308932637e+18,qme,2022-07-30 02:10:23,1.553191625765302e+18,4802389219.0,@Yuuta_ch36 https://t.co/JHfLEfD4ID,0,0,0,0,,,
1.553201300841435e+18,id,2022-07-30 02:10:21,1.553201300841435e+18,83994831.0,"Trus duit2 ku gimana ?!?!?!?!?! 

Steam, Epic Games, hingga PayPal Diblokir Kominfo Hari Ini karena Tak Daftar PSE https://t.co/JXDcF9C06w",0,0,0,0,"Then what do I do?!?!?!?!?!

Steam, Epic Games, until Paypal was blocked by Kominfo today because he did not list PSE https://t.co/jxdcf9c06w",0.1,0.4
1.55320125119386e+18,qme,2022-07-30 02:10:10,1.553104942675931e+18,4802389219.0,@AkunGratisan @kemkominfo https://t.co/JHfLEfD4ID,0,0,0,0,,,
1.553201212417524e+18,qme,2022-07-30 02:10:00,1.553181699437371e+18,4802389219.0,@Apin180 https://t.co/JHfLEfD4ID,0,0,0,0,,,
1.553201210303267e+18,id,2022-07-30 02:10:00,1.553201210303267e+18,2582870048.0,"Dari kasus KOMINFO memblokir beberapa situs seperti Steam, Epic Games, dan lain-lain. Bisa diambil kesimpulan bahwa banyak para pemangku jabatan di Indonesia itu yang ternyata tidak mengikuti perkembangan jaman atau tidak relate dengan keadaan sekarang.",0,1,0,0,"From the case of the Ministry of Communication and Information block several sites such as Steam, Epic Games, and others. It can be concluded that many positions in Indonesia who apparently did not follow the development of the times or not relate to the current situation.",0.1083333333333333,0.3583333333333333
1.553201170969395e+18,qme,2022-07-30 02:09:50,1.553152626258493e+18,4802389219.0,@yamahaYuuki https://t.co/JHfLEfD4ID,0,0,0,0,,,
1.55320115472069e+18,id,2022-07-30 02:09:47,1.552203283535606e+18,1.305914079987466e+18,"@kemkominfo Semoga org"" kominfo diberikan kesusahan🙏, steam dan epic games di block, gamedev Indo mana yg mau di dukung? Kocak, industri 4.0 palalu, paypal jg diblock, org"" freelancer gmn nasib nya, ngasih kerjaan kagak, tpi ginian diblock, gblok blokk... bubar ae lah kominfo",0,1,1,0,"@kemkominfo Hopefully the ""Communication and Information Communication and Information will be given trouble, Steam and Epic Games are blocked, Gamedev Indo which one you want to support? Hilarious, Industry 4.0 Palalu, Paypal is also blocked, org"" freelancer gmn fate, giving work, but giniated Bloking Blokk ... Disband AE LAH Kominfo",0.1333333333333333,0.5333333333333333
1.553201132532826e+18,qme,2022-07-30 02:09:41,1.553145617232212e+18,4802389219.0,@Ghis_Geralt https://t.co/JHfLEfD4ID,0,0,0,0,,,
1.553201122227388e+18,id,2022-07-30 02:09:39,1.55320021861496e+18,133155326.0,"@PanduFuzztoni @FortniteGame Diblok bang Epic Games sama Steam sama kominfo, coba cek #BlokirKominfo",0,1,0,0,"@Pandufuzzzton @fortnitegame blocked bang epic games with steam with the Ministry of Communication and Information, try to check #Blokirkominfo",0.1,0.4
1.553201072965308e+18,qme,2022-07-30 02:09:27,1.553148282754388e+18,4802389219.0,@Pistachiococola https://t.co/JHfLEfD4ID,0,0,0,0,,,
1.553201021123707e+18,id,2022-07-30 02:09:15,1.553201021123707e+18,1.474581451832127e+18,"Kominfo kontol, Steam, Epic games, Dan teman2 ny di blokir secara tiba2 anjrit, Giliran website slot judi kagak di blokir, Kita nih mau maju bukan balik ke zaman purba, Daripada blokir steam mending #BlokirKominfo",0,0,0,0,"Kominfo dick, steam, epic games, and friends are blocked suddenly anjrit, turn to the gambling slot website is not blocked, we want to advance instead of returning to ancient times, rather than blocking steam mending #blokirkominfo",0.05,0.45
1.553200924281143e+18,id,2022-07-30 02:08:52,1.553200924281143e+18,157354990.0,"Lagian aneh-aneh aja dah, yang adem ayem malah dicari gara-gara. Ngapain segala epic, steam, origin, Paypal, battlenet di blokir dah!

Urusin aja dulu tuh pinjol pinjol merajalela

#kominfo https://t.co/fGN9L5kRiH",1,0,3,0,"Besides, it's just weird, the cool thing is even sought because of. What are you doing all epic, steam, origin, paypal, battlenet blocked!

Just take care of the loan loans first

#kominfo https://t.co/fgn9l5krih",0.05624999999999999,0.5958333333333333
1.553200853573849e+18,en,2022-07-30 02:08:35,1.553200853573849e+18,21739678.0,"So...Our Great Minister of Information and Communication decides to block of any digital marketplace /platform incl Steam, Epic and even Paypal 🤣🤣 JUST BECAUSE THEY DONT REGISTER? 

oh...brain where are you brain? ,🤸

#kominfo #masukakalsedikit #netizenbicara #whykominfo",0,0,0,0,"So...Our Great Minister of Information and Communication decides to block of any digital marketplace /platform incl Steam, Epic and even Paypal 🤣🤣 JUST BECAUSE THEY DONT REGISTER? 

oh...brain where are you brain? ,🤸

#kominfo #masukakalsedikit #netizenbicara #whykominfo",0.3,0.3833333333333333
1.553200818106831e+18,id,2022-07-30 02:08:26,1.553200818106831e+18,257361165.0,Potret warga setelah steam dan epic diblok kominfo #BlokirKominfo https://t.co/daTcDEnk76,0,0,0,1,Portrait of residents after Steam and Epic were blocked by the Kominfo #Blokirkominfo https://t.co/datcdenk76,0.1,0.4
1.553200759176516e+18,id,2022-07-30 02:08:12,1.553200759176516e+18,1.389934531726045e+18,"Epic games, Paypal, steam diblok. Giliran situs slot kok ga di blok ?.
Parah bet pdhl gw Bru mo login steam tpi gegara Kominfo gaje jdi gabisa. Gblk emng

#BlokirKominfo",0,0,0,0,"Epic Games, Paypal, Steam is blocked. How come the slot site is not blocked?
Bad bet pdhl I bru mo login steam but the state of the Kominfo Gaje is GABI. Gblk emng

#Blokirkominfo",-0.2999999999999999,0.5333333333333333
1.553200624426435e+18,en,2022-07-30 02:07:40,1.553200624426435e+18,112050974.0,"Dear, @TimSweeneyEpic this is Panji Saputro, journalist detikcom media from Indonesia. I hope you've a good day.

Do you know if Epic Games have been blocked in Indonesia today? May i have your opinion about it?

You can check it, here https://t.co/H8v1evhpNM",0,1,0,0,"Dear, @TimSweeneyEpic this is Panji Saputro, journalist detikcom media from Indonesia. I hope you've a good day.

Do you know if Epic Games have been blocked in Indonesia today? May i have your opinion about it?

You can check it, here https://t.co/H8v1evhpNM",0.4,0.5
1.553200582520762e+18,id,2022-07-30 02:07:30,1.553200582520762e+18,1.364965290170348e+18,"Bajingan heh heh.. maunya apaan anying kominfo blokir blokir steam sama epic game anyingg... 

Walah walah ada ada aja lembaga di negeri tercinta ini",0,0,0,0,"Banjingan heh heh .. what do you want Anying Kominfo blocking steam and epic game anyingg ...

Wow, there are institutions in this beloved country",0.125,0.7
1.553200573112938e+18,id,2022-07-30 02:07:28,1.553200573112938e+18,986548034.0,Steam/Epic diblokir berarti Kominfo/Pemerintah mendukung rakyatnya main game illegal alias bajakan dong yaa? wkwkkwkw tolol bat 🤣🤣🤣🤣,0,0,0,0,"Steam/Epic is blocked means the Ministry of Communication and Information/the government supports its people to play illegal games, aka pirated, huh? wkwkkwkw stupid bat 🤣🤣🤣🤣",-0.6499999999999999,0.75
1.553200251896353e+18,id,2022-07-30 02:06:11,1.553200251896353e+18,46693036.0,"Diblokir Kominfo, Epic Games dan Steam Kini Tak Bisa Diakses https://t.co/GKTnpBlt8I #Ototekno #Blokirkominfo",0,0,0,0,"Blocked by Kominfo, Epic Games and Steam now cannot be accessed https://t.co/gktnpblt8i #ototekno #blokirkominfo",0.1,0.4
1.553200130626834e+18,en,2022-07-30 02:05:42,1.553200130626834e+18,1.370342227436708e+18,"URGENT NEWS:
Kominfo has blocked Epic Games Launcher, Steam, Paypal, and other websites too. This is not a drill, we can not access those respective websites and launchers #BlokirKominfo #Indonesia",24,3,69,4,"URGENT NEWS:
Kominfo has blocked Epic Games Launcher, Steam, Paypal, and other websites too. This is not a drill, we can not access those respective websites and launchers #BlokirKominfo #Indonesia",-0.008333333333333331,0.2916666666666667
1.553199999349293e+18,id,2022-07-30 02:05:11,1.553199999349293e+18,1.415972395995697e+18,"yok blokir kominfo yok #BlokirKominfo 
[pic : gw nyoba masuk Epic Games Store] https://t.co/is6Yp8TvEy",0,0,3,0,"Yok Blocking Kominfo Yok #Blokirkominfo
[Pic: I tried to enter the Epic Games Store] https://t.co/is6yp8tvey",0.1,0.4
1.553199832596066e+18,id,2022-07-30 02:04:31,1.553199832596066e+18,1.177052356925514e+18,"-dips! Tiap beli game di steam, origin, atau epic itu kita udah bayar pajak ppn 10%, tapi kenapa malah diblok?? Kominfo mikirnya gimana si😡",0,1,1,0,"-Dips! Every time we buy a game in Steam, Origin, or Epic, we already pay the 10%VAT tax, but why is it blocked? Kominfo thinks about how it is",-0.15,0.4
1.553199814527316e+18,id,2022-07-30 02:04:27,1.553188847617331e+18,145622306.0,"@kemkominfo gak habis pikir sih kominfo :) steam, origin, epic games, paypal diblokir? :) wtf wtf banget",0,0,0,0,"@kemkominfo can't understand the Ministry of Communication and Information :) Steam, Origin, Epic Games, Paypal Blocked? :) WTF WTF Very",0.05000000000000002,0.7833333333333333
1.553199428181193e+18,id,2022-07-30 02:02:55,1.553199428181193e+18,1227149880.0,"kominfo blokir steam, riot, epic games > masyarakat indo protes > kominfo unblock

bakalan seneng, tapi dri dulu pemerintah plin-plan mulu anying",0,1,0,0,"Kominfo Blocking Steam, Riot, Epic Games> Indo Protest Communities> Communication and Information Unblock

going to be happy, but from the past the government was a fickle",0.2166666666666667,0.5499999999999999
1.55319935878683e+18,id,2022-07-30 02:02:38,1.55319935878683e+18,1595534647.0,Gua yakin kominfo gak pernah claim game gratis di Epic Games makanya di blokir,0,1,0,0,"I'm sure Kominfo has never claimed a free game in Epic Games, so it was blocked",0.15,0.6222222222222222
1.553199274355466e+18,id,2022-07-30 02:02:18,1.553153893114483e+18,1.413132870500053e+18,@txtfrombrand Why gitu kenapa mereka blokir steam apa karena orang kominfo lagi main dota kena comback atau main epic games main fall guy jatuh terus ahhh bingung gw https://t.co/ExTgTWaZjJ,0,0,0,0,@txtfrombrand why why do they block steam what because the communication and information people are playing dota hit by a comback or playing epic games playing fall guy and fell on ahhh confused I https://t.co/extgtwazjjjjjjjjjjjjjjjjjjjjjjjjjjjjjjjjjjjj,-0.15,0.55
1.553199228197175e+18,en,2022-07-30 02:02:07,1.553196945258463e+18,246649342.0,"Origin juga confirmed here we go…

https://t.co/K7YvhhI2a2",0,1,0,0,"Origin juga confirmed here we go…

https://t.co/K7YvhhI2a2",0.4,1.0
1.55319897959655e+18,id,2022-07-30 02:01:08,1.55319897959655e+18,1863220892.0,"PayPal, Steam, Hingga Epic Games Trending Topic, Diblokir Kominfo?

#BlokirKominfo #steam #paypal

https://t.co/S0J0ayfcK4",1,0,1,0,"Paypal, Steam, to Epic Games Trending Topic, blocked by the Ministry of Communication and Information?

#Blokirkominfo #steam #paypal

https://t.co/s0j0ayfck4",0.1,0.4
1.553198820649243e+18,id,2022-07-30 02:00:30,1.553198820649243e+18,499733186.0,"Gimana nih kominfo. Matiin rezeki para streamer dan freelancer. Gara gara blokir steam, epic, paypal dll. Kecewa berat sama kominfo. #BlokirKominfo",0,0,2,0,"How about this Communication and Information. Turn off the fortune of streamers and freelancers. Because of blocking steam, epic, paypal etc. Disappointed with the Ministry of Communication and Information. #Blokirkominfo",-0.325,0.575
1.553198715217023e+18,id,2022-07-30 02:00:05,1.553198715217023e+18,2340155395.0,"Beberapa perusahaan teknologi dan pengembang game, menjadi trending topic Twitter.

https://t.co/iFZpDoS1MB",0,0,1,0,"Some technological companies and game developers are a Twitter trending topic.

https://t.co/ifzpdos1mb",-0.4,0.4
1.553198544114184e+18,id,2022-07-30 01:59:24,1.553198544114184e+18,176341068.0,"Kominfo Blokir Steam, Epic Games, Dota 2, Hingga CS:GO Pada Sabtu Hari Ini via @idgs_community https://t.co/uIizdRQZWs 

#IDGS",1,0,1,0,"Kominfo Block Steam, Epic Games, Dota 2, to CS: Go on Saturday today via @idgs_community https://t.co/uiizdrqzws

#Idgs",0.1,0.4
1.55319843582994e+18,id,2022-07-30 01:58:58,1.55319843582994e+18,1.535191601806742e+18,"Steam, Epic Games, Counter Strike, Dota, dan Origin Sudah Diblokir Kominfo Hari Ini – https://t.co/bucvkG0vdI – Tekno Kompas.com- Google Berita- https://t.co/ycotnxCQIA – #Opsiin https://t.co/27XHsshe8Z",0,0,0,0,"Steam, Epic Games, Counter Strike, Dota, and Origin have been blocked by Kominfo today- https://t.co/bucvkg0vdi- Tekno Kompas.com- Google Berita- https://t.co/ycotnxcqia- #opsiin https: //t.co/27xhssshe8z",0.1,0.4
1.553197808244736e+18,id,2022-07-30 01:56:29,1.553197808244736e+18,135815019.0,"Pagi ini, sebagian netizen teriak bahwa beberapa layanan internet yang cukup populer terblokir. Di antaranya adalah Steam, Epic Games dan Paypal.  https://t.co/Rpn5WRfuhw",0,1,0,0,"This morning, some netizens shouted that some internet services that were quite popular were blocked. Among these are Steam, Epic Games and Paypal. https://t.co/rpn5wrfuhw",0.35,0.65
1.553197808181723e+18,id,2022-07-30 01:56:29,1.553197808181723e+18,69183155.0,"Pagi ini, sebagian netizen teriak bahwa beberapa layanan internet yang cukup populer terblokir. Di antaranya adalah Steam, Epic Games dan Paypal.  https://t.co/xd5X1jnR7E",8,1,12,3,"This morning, some netizens shouted that some internet services that were quite popular were blocked. Among these are Steam, Epic Games and Paypal. https://t.co/xd5x1jnr7e",0.35,0.65
1.553197542581871e+18,id,2022-07-30 01:55:25,1.553197542581871e+18,2345275860.0,"#BlokirKominfo Dengan memblokir Steam, EPIC, EA Origin berarti pemerintah memaksa konsumen untuk kembali ke dunia game BAJAKAN dan merusak industri game / game retail Indonesia! Sebelum melakukan blokir, ada baiknya @kominfo mengkaji dampaknya terhadap industri ini!",0,0,1,0,"#Blokirkominfo By blocking Steam, Epic, EA Origin means the government forces consumers to return to the world of pirated games and damage the Indonesian retail game / game industry! Before blocking, it's good @kominfo examines the impact on this industry!",0.01874999999999999,0.4500000000000001
1.553197407059468e+18,id,2022-07-30 01:54:53,1.553197407059468e+18,69183155.0,Ada delapan Penyelenggara Sistem Elektronik (PSE) Lingkup Privat yang resmi diblokir oleh Kementerian Komunikasi dan Informatika (Kominfo).  https://t.co/JBG8dVjMmE,25,6,53,8,There are eight Electronic Systems Organizers (PSE) Private scope which is officially blocked by the Ministry of Communication and Information (Kominfo). https://t.co/jbg8dvjmme,0.0,0.375
1.553197404077392e+18,id,2022-07-30 01:54:52,1.553197404077392e+18,135815019.0,Ada delapan Penyelenggara Sistem Elektronik (PSE) Lingkup Privat yang resmi diblokir oleh Kementerian Komunikasi dan Informatika (Kominfo).  https://t.co/GfuXM86h0n,0,0,4,1,There are eight Electronic Systems Organizers (PSE) Private scope which is officially blocked by the Ministry of Communication and Information (Kominfo). https://t.co/gfuxm86h0n,0.0,0.375
1.55319735007592e+18,id,2022-07-30 01:54:39,1.55319735007592e+18,2333555780.0,"Resmi 

Steam, Origin, PayPal, Battlenet, Epic Games dan lainya telah diblokir oleh kominfo.

Terus kami mau main apa lagi pak?
Nonton bokep?
Main slot gitu?

Mbok kalo mau blokir di pilih-pilih dulu tolol.

#BlokirKominfo #kominfoAsu https://t.co/MG36NlshYz",0,0,0,0,"Official

Steam, origin, paypal, battlenet, epic games and others have been blocked by the Ministry of Communication and Information.

Then what else do we want to play sir?
Watch porn?
Playing slot like that?

Mbok if you want to block it, voted first stupid.

#Blokirkominfo #kominfoasu https://t.co/mg36nlshyz",-0.15,0.5777777777777778
1.553197155158233e+18,id,2022-07-30 01:53:53,1.553197155158233e+18,1.253694700260717e+18,"Kominfo ada masalah apa sih blokir steam, paypall, epic games #BlokirKominfo",0,0,1,0,"Kominfo has a problem, what are the blocking steam, paypall, epic games #blokirkominfo",0.1,0.4
1.553197073666679e+18,id,2022-07-30 01:53:34,1.553197073666679e+18,43042132.0,"pagi ini, ketika saya ingin menikmati teh sambil bermain game, namun tidak bisa connect ke steam.

ternyata oh ternyata......

luar biasaaa

https://t.co/gNCU2BDidy https://t.co/1sHgI0zlGy",0,1,0,0,"This morning, when I want to enjoy tea while playing games, but can't connect to Steam.

it turns out oh it turns out ......

extraordinary

https://t.co/gncu2bdidy https://t.co/1shgi0zlgy",0.3666666666666667,0.75
1.553196977172914e+18,id,2022-07-30 01:53:11,1.553196977172914e+18,620874207.0,"BREAKING: Steam, Origin, hingga Epic Games resmi di blokir oleh Kominfo. Udah gila. #BlokirKominfo https://t.co/pI6xQsdKu0",49,19,76,21,"Breaking: Steam, Origin, to Epic Games officially blocked by Kominfo. Already crazy. #Blokirkominfo https://t.co/pi6xqsdku0",-0.25,0.65
1.553196843160314e+18,en,2022-07-30 01:52:39,1.553196843160314e+18,536113420.0,"first thing madness i wake up to is steam epic games getting blocked by kominfo

sometimes i wonder what goes inside their head....",0,0,0,0,"first thing madness i wake up to is steam epic games getting blocked by kominfo

sometimes i wonder what goes inside their head....",0.175,0.3666666666666667
1.553196829302747e+18,en,2022-07-30 01:52:35,1.553196829302747e+18,1.345916764064911e+18,"If you guys didn't know, our government blocks Steam, Epic Games and Paypal because......they didn't register to PSE of Kominfo.

I really despise this because they thought they are above everyone and everyone need to abide to their rule. https://t.co/odn5lOBMVr",0,1,0,0,"If you guys didn't know, our government blocks Steam, Epic Games and Paypal because......they didn't register to PSE of Kominfo.

I really despise this because they thought they are above everyone and everyone need to abide to their rule. https://t.co/odn5lOBMVr",0.1,0.2333333333333334
1.553196339520995e+18,id,2022-07-30 01:50:38,1.553196339520995e+18,46693036.0,"Sesuai pengumuman Kementerian Komunikasi dan Informatika (Kominfo) terkait 10 layanan yang belum mendaftar Penyelenggara Sistem Elektronik (PSE) kendati sudah dikirimkan surat teguran. Kominfo sudah mulai memblokir layanan tersebut mulai hari ini.

https://t.co/i06QItzwcQ",0,0,1,1,"In accordance with the announcement of the Ministry of Communication and Information (Kominfo) related to 10 services that have not registered for the organizer of the Electronic System (PSE) even though a warning letter has been sent. Kominfo has started blocking the service starting today.

https://t.co/i06qitzwcq",0.0,0.25
1.553196334714221e+18,id,2022-07-30 01:50:37,1.553196334714221e+18,619774462.0,"Steam sama epic games beneran diblokir kominfo ya 🥲 gimana nasib game yang dibeli, lumayan lagi harganya 🥹",0,0,0,0,Steam and Epic Games are really blocked by the Ministry of Communication and Information,0.15,0.3
1.553196288274944e+18,id,2022-07-30 01:50:26,1.553196288274944e+18,267552581.0,"https://t.co/xEOrXiS7pU

Opo hiburanku Iki..mosok pijet?mosok Nang oyo?karaokean?

Apa hiburan ndk indo sng di Trimo sng ""slebew2""?",0,1,0,0,"https://t.co/xeorxis7pu

Opo my entertainment iki..mosh massage? Mosok nang oyo? Karaoke?

What is the entertainment of Indo SNG in Trimo SNG ""SLEBEW2""?",0.0,0.0
1.553196232218411e+18,id,2022-07-30 01:50:13,1.553196232218411e+18,1.429745038456549e+18,"Kementerian Komunikasi (Kominfo) dini hari tadi telah memblokir Paypal, Steam dan Epic Games.
#BlokirKominfo https://t.co/Zg0KOjD8dS",0,1,0,0,"The Ministry of Communication (Kominfo) early this morning had blocked Paypal, Steam and Epic Games.
#Blokirkominfo https://t.co/zg0kojd8ds",0.1,0.35
1.553196019747553e+18,id,2022-07-30 01:49:22,1.553196019747553e+18,21754660.0,"Kominfo Resmi Blokir Steam, Epic Games Store, dan Kawan-kawannya https://t.co/n8kLbpEwcl",0,0,0,0,"Kominfo Official Blocking Steam, Epic Games Store, and his friends https://t.co/n8klbpewcl",0.1,0.4
1.553195899366429e+18,id,2022-07-30 01:48:54,1.553195899366429e+18,1637736600.0,anjing wkwkwkwkw steam sama epic diblock kominfo wkwkwkwkwkw bagas31 masi lancar jaya wkwkwkwkwwkwkwk emg di negara kita ini di-encourage buat main bajakan 👍🏼👍🏼👍🏼👍🏼👍🏼 good job KEMKOMINFO,0,1,0,0,anjing wkwkwkwkw steam sama epic diblock kominfo wkwkwkwkwkw bagas31 masi lancar jaya wkwkwkwkwwkwkwk emg di negara kita ini di-encourage buat main bajakan 👍🏼👍🏼👍🏼👍🏼👍🏼 good job KEMKOMINFO,0.3222222222222222,0.4444444444444445
1.553195709691675e+18,id,2022-07-30 01:48:08,1.553195709691675e+18,28201831.0,"Sebagai seorang gamer yg hampir tiap hari akses Steam dll, pemblokiran ini hits hard sih. Game jd jalan keluar gw dari rutinitas dan stress of everyday life. Ironis yg dikejar-kejar yg kaya gini sementara keamanan data pribadi kita masih ga ada jaminan.

https://t.co/mhF5rTSCDW",44,2,67,2,"As a gamer who almost every day Steam access, etc., this blocking is a hard hits. The game is a way out of me from the routine and stress of everyday life. Ironic that is chased like this while the security of our personal data is still no guarantee.

https://t.co/MHF5RTscdw",-0.1383333333333333,0.5483333333333332
1.553195673490563e+18,id,2022-07-30 01:48:00,1.553195673490563e+18,1.248803836862456e+18,"EPIC GAMES KOK DI BLOKIRR :(((((((
Ini emang disuruh main pou deh kayaknya sama kominfo",0,0,0,0,"Epic Games, how come it is blocked: ((((((((((((((((((((((((((
This is told to play Pou, I think it's the same as the Ministry of Communication and Information",-0.2166666666666667,0.5083333333333333
1.553195631895671e+18,ht,2022-07-30 01:47:50,1.553195631895671e+18,1.154040967067865e+18,"Man- Why Kemenkominfo 🤦🤦🤦🤦
https://t.co/aqMzIXQql5",0,0,1,0,"Man- Why Kemenkominfo 🤦🤦🤦🤦
https://t.co/aqmzixqql5",0.0,0.0
1.553195607828836e+18,id,2022-07-30 01:47:44,1.553195607828836e+18,369343676.0,"Tujuan kominfo kek gini tuh apayaa? Sampe ke steam, epic, paypal diblokir. Asli pagi2 bikin kegaduhan aja",0,1,0,0,"The purpose of the Communication and Information is like this? Until Steam, Epic, Paypal are blocked. Original morning just make a commotion",0.2375,0.575
1.553195488492798e+18,id,2022-07-30 01:47:16,1.553195488492798e+18,1863220892.0,"PayPal, Steam, Hingga Epic Games Trending Topic, Diblokir Kominfo?

#BlokirKominfo

https://t.co/S0J0ayfcK4 https://t.co/dFZR8kmIlY",0,0,0,0,"Paypal, Steam, to Epic Games Trending Topic, blocked by the Ministry of Communication and Information?

#Blokirkominfo

https://t.co/s0j0ayfck4 https://t.co/dfzr8kmily",0.1,0.4
1.55319542711756e+18,id,2022-07-30 01:47:01,1.55319542711756e+18,1353247362.0,Steam sama Epic Games diblokir? Kominfo nitah main slot kitu?,0,0,0,0,Steam and Epic Games are blocked? Kominfo is not playing with a slot?,0.1,0.4
1.553195101241098e+18,id,2022-07-30 01:45:43,1.553195101241098e+18,60757395.0,"Kominfo Blokir Game di Steam, Uplay, hingga Epic Game, Ini Penjelasannya https://t.co/sLOVMetJ7F",0,0,0,0,"Kominfo block games in Steam, Uplay, to Epic Game, this is the explanation https://t.co/slovmetj7f",-0.15,0.4
